{
  "artifact_sha256": "3333333333333333333333333333333333333333333333333333333333333333",
  "build_commit": "0000000000000000000000000000000000000000",
  "config_bundle_sha256": "2222222222222222222222222222222222222222222222222222222222222222",
  "contract_manifest_sha256": "1111111111111111111111111111111111111111111111111111111111111111",
  "emitted_at_us": 1786156800123456,
  "event_id": "evt_triad_raw_venue_event_v2",
  "event_kind": "RAW_VENUE_EVENT",
  "payload": {
    "event_time": 1786156800123456,
    "instrument_id": "x-instrument",
    "metadata_revision": "1",
    "payload_bytes_digest": "0000000000000000000000000000000000000000000000000000000000000000",
    "payload_kind": "trade",
    "quarantine_flags": {
      "clock": false,
      "dq": false,
      "gap": false
    },
    "receive_time": 1786156800123456,
    "route_id": "x-route",
    "session_id": "x-session",
    "source_sequence": "1",
    "venue": "binance-usdm"
  },
  "producer_epoch": "42",
  "producer_instance_id": "inst_golden_01",
  "producer_service": "triad-e00",
  "schema": "triad.raw_venue_event.v2",
  "schema_version": "2.0.0"
}
